{"schema_version":"pysolate.branch-dag.v1","source_sha256":"sha256:3222d98ecec889b156cb3d3919390363150eef947cc361ff5b4d62be7fefc338","generated_at_policy":"omitted","nodes":[{"run_id":"run-ordinary","status":"completed","evidence_completeness":"complete"},{"run_id":"run-ordinary-parent","status":"completed","evidence_completeness":"complete"}],"edges":[],"page":{"cursor":"","next_cursor":"","returned":2,"total":2,"truncated":false}}